[
  {
    "id": "seed-requests-1",
    "repo": "psf/requests",
    "path": "src/requests/utils.py",
    "event_type": "security",
    "base_sha": "7341690e",
    "head_sha": "96ba401c",
    "evidence_tier": "seed-dev",
    "seed_dev": true,
    "label": "CVE-2024-47081",
    "pr_number": null,
    "source_url": null
  },
  {
    "id": "seed-requests-2",
    "repo": "psf/requests",
    "path": "requests/sessions.py",
    "event_type": "security",
    "base_sha": "30222533",
    "head_sha": "74ea7cf7",
    "evidence_tier": "seed-dev",
    "seed_dev": true,
    "label": "CVE-2023-32681",
    "pr_number": null,
    "source_url": null
  },
  {
    "id": "seed-scrapy",
    "repo": "scrapy/scrapy",
    "path": "scrapy/downloadermiddlewares/redirect.py",
    "event_type": "security",
    "base_sha": "aa0306a1",
    "head_sha": "8ce01b3b",
    "evidence_tier": "seed-dev",
    "seed_dev": true,
    "label": "CVE-2022-0577",
    "pr_number": null,
    "source_url": null
  },
  {
    "id": "seed-flask",
    "repo": "pallets/flask",
    "path": "src/flask/sessions.py",
    "event_type": "security",
    "base_sha": "9532cba4",
    "head_sha": "8705dd39",
    "evidence_tier": "seed-dev",
    "seed_dev": true,
    "label": "CVE-2023-30861",
    "pr_number": null,
    "source_url": null
  },
  {
    "id": "seed-celery",
    "repo": "celery/celery",
    "path": "celery/backends/base.py",
    "event_type": "security",
    "base_sha": "2d8dbc2a",
    "head_sha": "1f7ad7e6",
    "evidence_tier": "seed-dev",
    "seed_dev": true,
    "label": "CVE-2021-23727",
    "pr_number": null,
    "source_url": null
  },
  {
    "id": "seed-fastapi",
    "repo": "tiangolo/fastapi",
    "path": "fastapi/routing.py",
    "event_type": "security",
    "base_sha": "90120dd6",
    "head_sha": "fa7e3c99",
    "evidence_tier": "seed-dev",
    "seed_dev": true,
    "label": "CVE-2021-32677",
    "pr_number": null,
    "source_url": null
  },
  {
    "id": "seed-curl",
    "repo": "curl/curl",
    "path": "lib/socks.c",
    "event_type": "security",
    "base_sha": "09e25b9d",
    "head_sha": "fb4415d8",
    "evidence_tier": "seed-dev",
    "seed_dev": true,
    "label": "CVE-2023-38545",
    "pr_number": null,
    "source_url": null
  },
  {
    "id": "seed-golang-go",
    "repo": "golang/go",
    "path": "src/cmd/go/internal/work/security.go",
    "event_type": "security",
    "base_sha": "6d8af00a",
    "head_sha": "bbeb55f5",
    "evidence_tier": "seed-dev",
    "seed_dev": true,
    "label": "CVE-2023-29404",
    "pr_number": null,
    "source_url": null
  },
  {
    "id": "seed-axios",
    "repo": "axios/axios",
    "path": "lib/adapters/xhr.js",
    "event_type": "security",
    "base_sha": "7d45ab2e",
    "head_sha": "96ee232b",
    "evidence_tier": "seed-dev",
    "seed_dev": true,
    "label": "CVE-2023-45857",
    "pr_number": null,
    "source_url": null
  },
  {
    "id": "seed-spring4shell",
    "repo": "spring-projects/spring-framework",
    "path": "spring-beans/src/main/java/org/springframework/beans/CachedIntrospectionResults.java",
    "event_type": "security",
    "base_sha": "1627f57f",
    "head_sha": "002546b3",
    "evidence_tier": "seed-dev",
    "seed_dev": true,
    "label": "CVE-2022-22965",
    "pr_number": null,
    "source_url": null
  },
  {
    "id": "seed-rust-regex",
    "repo": "rust-lang/regex",
    "path": "src/compile.rs",
    "event_type": "security",
    "base_sha": "b92ffd54",
    "head_sha": "ae70b41d",
    "evidence_tier": "seed-dev",
    "seed_dev": true,
    "label": "CVE-2022-24713",
    "pr_number": null,
    "source_url": null
  },
  {
    "id": "seed-etcd",
    "repo": "etcd-io/etcd",
    "path": "server/etcdserver/v3_server.go",
    "event_type": "security",
    "base_sha": "801bb4c6",
    "head_sha": "8b1cd036",
    "evidence_tier": "seed-dev",
    "seed_dev": true,
    "label": "CVE-2021-28235",
    "pr_number": null,
    "source_url": null
  },
  {
    "id": "seed-tokio",
    "repo": "tokio-rs/tokio",
    "path": "tokio/src/net/windows/named_pipe.rs",
    "event_type": "security",
    "base_sha": "5c76d070",
    "head_sha": "9241c3ed",
    "evidence_tier": "seed-dev",
    "seed_dev": true,
    "label": "CVE-2023-22466",
    "pr_number": null,
    "source_url": null
  },
  {
    "id": "seed-netty",
    "repo": "netty/netty",
    "path": "codec-http/src/main/java/io/netty/handler/codec/http/HttpObjectDecoder.java",
    "event_type": "security",
    "base_sha": "cf63bc10",
    "head_sha": "a7c18d44",
    "evidence_tier": "seed-dev",
    "seed_dev": true,
    "label": "CVE-2019-20444",
    "pr_number": null,
    "source_url": null
  },
  {
    "id": "seed-laravel",
    "repo": "laravel/framework",
    "path": "src/Illuminate/Filesystem/LocalFilesystemAdapter.php",
    "event_type": "security",
    "base_sha": "071ac5c3",
    "head_sha": "cba82e4e",
    "evidence_tier": "seed-dev",
    "seed_dev": true,
    "label": "GHSA-crmm-hgp2-wgrp",
    "pr_number": null,
    "source_url": null
  },
  {
    "id": "seed-rails",
    "repo": "rails/rails",
    "path": "actionview/lib/action_view/helpers/translation_helper.rb",
    "event_type": "security",
    "base_sha": "723f5456",
    "head_sha": "4c83b331",
    "evidence_tier": "seed-dev",
    "seed_dev": true,
    "label": "CVE-2024-26143",
    "pr_number": null,
    "source_url": null
  },
  {
    "id": "seed-dotnet",
    "repo": "dotnet/runtime",
    "path": "src/libraries/System.Formats.Tar/src/System/Formats/Tar/TarEntry.cs",
    "event_type": "security",
    "base_sha": "b06f62fc",
    "head_sha": "8c91e3b2",
    "evidence_tier": "seed-dev",
    "seed_dev": true,
    "label": "CVE-2026-45491",
    "pr_number": null,
    "source_url": null
  },
  {
    "id": "seed-git",
    "repo": "git/git",
    "path": "unpack-trees.c",
    "event_type": "security",
    "base_sha": "0d58fef5",
    "head_sha": "22539ec3",
    "evidence_tier": "seed-dev",
    "seed_dev": true,
    "label": "CVE-2021-21300",
    "pr_number": null,
    "source_url": null
  },
  {
    "id": "seed-lodash",
    "repo": "lodash/lodash",
    "path": "lodash.js",
    "event_type": "security",
    "base_sha": "ded9bc66",
    "head_sha": "3469357c",
    "evidence_tier": "seed-dev",
    "seed_dev": true,
    "label": "CVE-2021-23337",
    "pr_number": null,
    "source_url": null
  }
]
